{
  "@context": "https://schema.org",
  "@type": "ItemList",
  "name": "SovereignSky Blog",
  "description": "Articles on digital sovereignty, cloud independence, and data protection",
  "itemListElement": [
    {
      "@type": "BlogPosting",
      "identifier": "2025-12-01-norway-exit-strategy",
      "name": "Norway's Digitalisation Minister: All Organizations Need a Cloud Exit Strategy",
      "description": "Minister Karianne Tung urges Norwegian organizations to prepare contingency plans for US cloud providers",
      "abstract": "Minister Karianne Tung urges Norwegian organizations to prepare contingency plans for US cloud providers",
      "datePublished": "2025-12-01",
      "author": [
        "SovereignSky"
      ],
      "image": "2025-12-01-norway-exit-strategy.png",
      "topics": [
        "digital-sovereignty",
        "platform-dependency",
        "cloud-act",
        "government-access"
      ],
      "tags": [
        "norway",
        "exit-strategy"
      ],
      "audience": [
        "public-sector",
        "it-ops",
        "enterprise",
        "humanitarian"
      ],
      "url": "https://www.digi.no/artikler/tung-ber-alle-ha-exit-strategi-klar-i-tilfelle-google-og-microsoft-blir-ulovlig/556705",
      "showHero": true,
      "draft": false,
      "body": "In March 2025, Norway's Minister of Digitalisation and Public Governance, Karianne Tung, made headlines by urging all government and public organizations to prepare for potential disruptions to American cloud services.\n\n## The Message\n\nSpeaking at the Digitaliseringskonferansen, Minister Tung emphasized that Norwegian organizations need contingency plans in case data transfers to the US become legally problematic. While she noted she didn't specifically use the term \"exit strategy,\" she stood firmly behind the concept.\n\nThe core message: Organizations that rely on Microsoft, Google, and other US cloud providers should have a plan ready for what happens if access to these services is disrupted - whether through regulatory changes, geopolitical events, or legal conflicts.\n\n## Why Now?\n\nSeveral factors are driving this urgency:\n\n1. **EU-US Data Privacy Framework fragility** - The framework enabling transatlantic data transfers depends on executive orders and oversight bodies that can shift with political changes.\n\n2. **CLOUD Act concerns** - US law requires American providers to hand over data to US authorities regardless of where it's stored.\n\n3. **Geopolitical instability** - Political decisions, international crises, or trade disputes could disrupt access to US cloud services.\n\n4. **Norwegian dependency** - NSM (Norwegian National Security Authority) reported that over 80% of protected data and systems will be in cloud solutions within ten years - largely outside Norwegian control.\n\n## The Reality Check\n\nMinister Tung acknowledged the challenge: \"It's naive to think we can move away from Microsoft and Google tomorrow. We are so dependent on those companies today, and it's demanding.\"\n\nThis isn't about immediate migration - it's about preparedness. Having a strategy means understanding:\n- What data and services you have in US cloud platforms\n- What alternatives exist\n- How quickly you could migrate if needed\n- What would break if access was lost\n\n## European Alternatives\n\nOrganizations looking to reduce US cloud dependency can consider:\n\n**Nordic providers:**\n- NetNordic (Norway)\n- Elastx (Sweden)\n- UpCloud (Finland)\n\n**European providers:**\n- Scaleway (France)\n- Hetzner (Germany)\n- OVHCloud (France)\n\n## Denmark Leading by Example\n\nMinister Tung has been following Denmark's approach closely. The Danish Digitalisation Ministry has announced plans to migrate from Windows to Linux and replace Office 365 with LibreOffice - with the goal of eliminating Microsoft dependency before year-end.\n\nTung indicated Norway is watching to \"see if we can think similarly.\"\n\n## What This Means for Organizations\n\nEvery organization using US cloud services should:\n\n1. **Inventory your cloud dependencies** - Know what you have where\n2. **Assess criticality** - What would the impact be if access was lost?\n3. **Evaluate alternatives** - What European or on-premise options exist?\n4. **Document a migration path** - Even if you never use it\n5. **Test your assumptions** - Can your critical systems actually run elsewhere?\n\n---\n\n## Sources\n\n- [Digi.no: Ber alle ha «exit-strategien» klar om Google og Microsoft blir ulovlig](https://www.digi.no/artikler/tung-ber-alle-ha-exit-strategi-klar-i-tilfelle-google-og-microsoft-blir-ulovlig/556705)\n- [Digi.no: Exit-strategi krever nasjonal sky-løsning](https://www.digi.no/artikler/kommentar-exit-strategi-krever-nasjonal-sky-losning/557001)\n- [Digi.no: Dansk Microsoft-exit - Ser om vi kan tenke likt i Norge](https://www.digi.no/artikler/folger-noye-med-pa-dansk-microsoft-utfasing-ser-om-vi-kan-tenke-likt-i-norge/559422)\n- [Computas: Amerikanske skyplattformer - Risikovurdering, exit-strategi og alternativer](https://computas.com/artikkel/amerikanske-skyplattformer-risikovurdering-exit-strategi-og-alternativer/)\n- [Regjeringen.no: Cloud Computing Strategy for Norway](https://www.regjeringen.no/en/documents/cloud-computing-strategy-for-norway/id2484403/)"
    },
    {
      "@type": "BlogPosting",
      "identifier": "2025-12-03-eu-cloud-sovereignty-framework",
      "name": "EU Launches €180 Million Sovereign Cloud Initiative",
      "description": "The European Commission commits major funding to reduce dependence on US hyperscalers",
      "abstract": "The European Commission commits major funding to reduce dependence on US hyperscalers",
      "datePublished": "2025-12-03",
      "author": [
        "SovereignSky"
      ],
      "image": "2025-12-03-eu-cloud-sovereignty-framework.png",
      "topics": [
        "digital-sovereignty"
      ],
      "tags": [],
      "audience": [
        "public-sector",
        "enterprise",
        "it-ops"
      ],
      "showHero": true,
      "draft": false,